{
	"jsonrpc": "2.0",
	"method": "tools/call",
	"params": {
		"name": "create_pull_request",
		"arguments": {
			"owner": "Ningensei848",
			"repo": "kaname-vault",
			"title": "[Wiki-Sync] Intelligence Update (2026-05-27)",
			"head": "osint/content-acd-update-20260527",
			"base": "main",
			"body": "## 提案要約\n- SSoTから能動的サイバー防御の新方針を検知。\n- 既存のトピック `[[能動的サイバー防御]]` のインクリメンタル更新を完了。"
		}
	},
	"id": 102
}
