{
	"jsonrpc": "2.0",
	"method": "tools/call",
	"params": {
		"name": "create_or_update_file",
		"arguments": {
			"owner": "Ningensei848",
			"repo": "kaname-vault",
			"path": "topics/gov-agencies/NCO.md",
			"content": "---\ntitle: NCO\n---\n# 本文...",
			"branch": "osint/content-acd-update-20260527",
			"message": "[Aegis-Writer] Update NCO cybersecurity policy"
		}
	},
	"id": 101
}
