{
	"jsonrpc": "2.0",
	"method": "tools/call",
	"params": {
		"name": "create_issue",
		"arguments": {
			"owner": "Ningensei848",
			"repo": "kaname-vault",
			"title": "[System Error] Crawling Failed for ID: nco",
			"body": "## 障害発生報告\n- **対象ソース**: 国家サイバー統括室 (NCO)\n- **ステータス**: 縮退運転を継続中です。"
		}
	},
	"id": 104
}
