{
	"jsonrpc": "2.0",
	"method": "tools/call",
	"params": {
		"name": "merge_pull_request",
		"arguments": {
			"owner": "Ningensei848",
			"repo": "kaname-vault",
			"pull_number": 42,
			"merge_method": "squash",
			"commit_title": "[Aegis-Reviewer] Self-Merge: Intelligence Update Passed Review"
		}
	},
	"id": 103
}
